Company Name,Full Description,Description,Founder Name,Founded In,Location,Category,No. of Employees,Company Website,Company Type,Technologies,Business Functions,Business Model,IndiaAI URL
vPhrase Analytics Solutions Pvt. Ltd.,vPhrase is an AI based platform that communicates a data to multiple languages.,"vPhrase is an AI based platform that communicates a data to multiple languages. | Technologies: Phrazor is deployed across multiple domains like banks, brokerage firms, healthcare | Type: Media company",,,"Maharashtra, India",,29,https://vASPL.in,Media,"Phrazor is deployed across multiple domains like banks, brokerage firms, healthcare, CPG companies, media and entertainment. The technology integrates with the client's system with the help of API and in some cases; the company provides an on-premise installation as well. The firm extends its services in the fields of quarterly earning analysis, stories, sales points from mutual fund fact-sheets, performance appraisal reports and many more.",,,https://indiaai.gov.in/startup/vphrase-analytics-solutions-pvt-ltd
Garuda Aerospace Pvt Ltd,,Technologies: India | Type: Other company,,2015,,,45,https://GAPL.com,Other,India,,,https://indiaai.gov.in/startup/garuda-aerospace-pvt-ltd
Videonetics Technology Pvt. Ltd.,World’s first AI & DL powered Unified Video Computing Platform™ development company.,World’s first AI & DL powered Unified Video Computing Platform™ development company. | Technologies: Pvt. Ltd. | Type: SaaS company,,2008,,,47,https://VTPL.in,SaaS,Pvt. Ltd.,,"With VCPaaS™, users can enjoy video management and intelligent surveillance on the cloud, anytime, anywhere. The Intelligent Video Analytics framework is an integral part of the cloud stack. For the service providers, it offers a new and better business model, with its ongoing, subscription-based revenue stream. It is also cost-effective, secure and easy to maintain. For subscribers, it allows them to get started without having to invest in servers and offers a wide choice of subscription plans. It comes with a mobile app to view, record, share video clips, rich insights from video analytics, and low bandwidth streaming.",https://indiaai.gov.in/startup/videonetics-technology-pvt-ltd
Myelin Foundry,,Technologies: The transformative power of technology will one of the most striking memories of the pandemic era. | Type: Technology company,Gopichand Katragadda is the,2019,,,20,https://myelinfoundry.com,Technology,The transformative power of technology will one of the most striking memories of the pandemic era.,,,https://indiaai.gov.in/startup/myelin-foundry
Eugenie.ai,Eugenie is an AI-powered predictive maintenance solution for Industry 4.0,Eugenie is an AI-powered predictive maintenance solution for Industry 4.0 | Type: Other company,,,"Maharashtra, India",,12,https://E.ai,Other,,,,https://indiaai.gov.in/startup/eugenie-ai
"Attentive AI creates digital maps by performing deep learning on satellite, aerial and drone imagery.",,"Attentive AI creates digital maps by performing deep learning on satellite, aerial and drone imagery. is a  company founded in 2017, based in Delhi, India",,2017,"Delhi, India",,50,http://www.unipune.ac.in/,AI/ML,,,,https://indiaai.gov.in/startup/attentive-ai-solutions-private-limited
CogniCor Technologies Pvt ltd,,Technologies: is a female-founded organization that provides AI-augmented digital assistants to financial services. The company is created out of Dr Sindhu Joseph’s PhD thesis. Their team has a unique mix of AI and wealth management expertise and offering a unique value proposition for the customers. They help enterprises to delight their customers by providing them with a cognitive interface which gives compliant and accurate answers and financial advice to their clients. | Type: Fintech company,,2013,,,70,https://CTPl.ai,Fintech,is a female-founded organization that provides AI-augmented digital assistants to financial services. The company is created out of Dr Sindhu Joseph’s PhD thesis. Their team has a unique mix of AI and wealth management expertise and offering a unique value proposition for the customers. They help enterprises to delight their customers by providing them with a cognitive interface which gives compliant and accurate answers and financial advice to their clients.,,,https://indiaai.gov.in/startup/cognicor-technologies-pvt-ltd
Decision Point Analytics,"Decision Point develops analytics & big data solutions for CPG, Retail & Consumer focussed industries.","Decision Point develops analytics & big data solutions for CPG, Retail & Consumer focussed industries. | Type: Other company",,,"Haryana, India",,0,https://decisionpointanalytics.in,Other,,,,https://indiaai.gov.in/startup/decision-point-analytics
Niramai,Health technology startup that develops breast cancer screening solutions,"Health technology startup that develops breast cancer screening solutions | Technologies: Niramai or Non-Invasive Risk Assessment with Machine Intelligence has developed an early breast cancer detection technology that is a radiation-free and non-invasive. The solution is based on thermal imaging and is portable, accurate, and can be used for women of all ages. | Type: Healthcare company",,2016,"Karnataka, India",,42,https://niramai.com,Healthcare,"Niramai or Non-Invasive Risk Assessment with Machine Intelligence has developed an early breast cancer detection technology that is a radiation-free and non-invasive. The solution is based on thermal imaging and is portable, accurate, and can be used for women of all ages.",,,https://indiaai.gov.in/startup/niramai
Tripeur,Unleashing the power of AI and Bots in the Corporate Travel Space,Unleashing the power of AI and Bots in the Corporate Travel Space | Type: Travel company,,2015,"Bengaluru, India",,34,https://tripeur.com,Travel,,,,https://indiaai.gov.in/startup/tripeur
Haptik,,Technologies: Artificial Intelligence technology-based start-ups on Thursday lauded government role in giving them back up and sought a regulatory regime... | Type: AI/ML company,Aakrit Vaish,2013,"Maharashtra, India",,175,https://haptik.ai,AI/ML,Artificial Intelligence technology-based start-ups on Thursday lauded government role in giving them back up and sought a regulatory regime...,,,https://indiaai.gov.in/startup/haptik
DronaMaps,An enterprise platform to help drone users extract analytics from imagery captured through drones.,An enterprise platform to help drone users extract analytics from imagery captured through drones. | Type: SaaS company,Ayushi Mishra,,"Haryana, India",,13,https://dronamaps.com,SaaS,,,,https://indiaai.gov.in/startup/dronamaps
Staqu Technologies Pvt. Ltd.,Staqu provides advanced AI tools for clients in law enforcement and security domain.,"Staqu provides advanced AI tools for clients in law enforcement and security domain. | Technologies: Staqu Technologies is an AI startup that provides advanced image analysis, language and speaker identification engine, and facial recognition and text processing for clients in law enforcement and security domain. Staqu targets B2B segment by customizing solutions for clients with a proprietary AI technology stack comprising: advanced image and video analysis tools and speech recognition | Type: Cybersecurity company",,,"Haryana, India",,33,https://STPL.com,Cybersecurity,"Staqu Technologies is an AI startup that provides advanced image analysis, language and speaker identification engine, and facial recognition and text processing for clients in law enforcement and security domain. Staqu targets B2B segment by customizing solutions for clients with a proprietary AI technology stack comprising: advanced image and video analysis tools and speech recognition, facial recognition and text processing APIs.",,,https://indiaai.gov.in/startup/staqu-technologies-pvt-ltd
Qure.ai,,"Technologies: With over a billion of the population in the country, India does not have enough number of radiologists. The skewed radiologists to patient ratio of 1:100K means early and timely disease detection is definitely a major challenge in the Indian healthcare market. Qure.ai was founded to address the need for affordable and accessible diagnostics using deep learning technology. The company claims its algorithms can detect clinically-relevant abnormal trauma findings from X-rays, CT Scans and MRIs in lesser time that doctors typically take which is about less than 3 minutes with 95 percent accuracy. | Type: Healthcare company",,2016,"Maharashtra, India",,30,https://Q.com,Healthcare,"With over a billion of the population in the country, India does not have enough number of radiologists. The skewed radiologists to patient ratio of 1:100K means early and timely disease detection is definitely a major challenge in the Indian healthcare market. Qure.ai was founded to address the need for affordable and accessible diagnostics using deep learning technology. The company claims its algorithms can detect clinically-relevant abnormal trauma findings from X-rays, CT Scans and MRIs in lesser time that doctors typically take which is about less than 3 minutes with 95 percent accuracy.",,,https://indiaai.gov.in/startup/qure-ai
H2O.ai,A technology platform which is democratizing AI,"A technology platform which is democratizing AI | Technologies: Undoubtedly, AI is becoming a key technology in many sectors. The way we looked at this technology a decade back is no longer valid. The... | Type: SaaS company",Sri Ambati is the,,"Tamil Nadu, India",,300,https://h2o.ai/company/,SaaS,"Undoubtedly, AI is becoming a key technology in many sectors. The way we looked at this technology a decade back is no longer valid. The...",,,https://indiaai.gov.in/startup/h2o-ai
Jovian.ml,Project tracking and collaboration platform for data science & machine learning,Project tracking and collaboration platform for data science & machine learning | Type: SaaS company,He is the co,2018,"Bengaluru, India",,10,https://J.ai,SaaS,,,,https://indiaai.gov.in/startup/jovian-ml
Forus Health,Forus Health is a medical technology company.,"Forus Health is a medical technology company. | Technologies: Forus Health is a medical technology company with an audacious goal — to eradicate preventable blindness, which is a global healthcare challenge today. | Type: Healthcare company",based in Bengaluru,,"Karnataka, India",,149,https://forushealth.com,Healthcare,"Forus Health is a medical technology company with an audacious goal — to eradicate preventable blindness, which is a global healthcare challenge today.",,"Preventable blindness affects millions of people around the world today. This scenario is further compounded by the poor ratio of ophthalmologists to patients in many countries across the world. Forus Health believes that innovation in technology and creative business models can help develop sustainable access to vision care. Creating social impact is in their DNA and every product they design is a direct consequence of solving a problem. This is the very philosophy with which Forus' founding team — curious minds passionate about creative problem-solving — set out to create a healthcare ecosystem in 2010 in Bangalore, India.",https://indiaai.gov.in/startup/forus-health
Vaultedge,,"Vaultedge is a  company founded in 2015, based in Karnataka, India",Founded on Innovation,2015,"Karnataka, India",,4,https://vaultedge.com,Other,,,,https://indiaai.gov.in/startup/vaultedge
EasyGov,EasyGov is empowering people and transforming governance.,EasyGov is empowering people and transforming governance. | Type: Other company,Amit Shukla,,"UP, India",,37,https://easygov.com,Other,,,,https://indiaai.gov.in/startup/easygov
Jungroo Learning,Jungroo is an AI-powered adaptive learning platform,Jungroo is an AI-powered adaptive learning platform | Technologies: is booming in India. Listed here are some startups that have created maximum impact... | Type: SaaS company,,,"Karnataka, India",,5,https://JL.ai,SaaS,is booming in India. Listed here are some startups that have created maximum impact...,,,https://indiaai.gov.in/startup/jungroo-learning
Rubique,Rubique is an online financial service platform.,"Rubique is an online financial service platform | Technologies: Fintech company, Rubique is the leading online financial matchmaking platform in India, formed with a vision to fulfill every financial aspiration during the customer's lifecycle in the simplest | Type: Fintech company",As the,,"Maharashtra, India",,111,https://R.ai,Fintech,"Fintech company, Rubique is the leading online financial matchmaking platform in India, formed with a vision to fulfill every financial aspiration during the customer's lifecycle in the simplest, shortest and speediest way through a wide range of loan & credit card products. Built on proprietary AI-based recommendation and fulfillment engine, Rubique’s marketplace platform has been integrated with financial institutions’ systems for real-time processing & provide online approval to the customer. The advance technology solution not only reduces the processing time significantly but the data analytics done on hundreds of data points helps to bring predictability & assess creditworthiness offering best deal to their customer. Currently, Rubique has partnership with over 89 leading financial institutions in India.",,,https://indiaai.gov.in/startup/rubique
DataGlen Technologies,DataGlen Technologies is an IoT and AI Solutions' platform for Digital Utilities and Smart Energy Networks.,"DataGlen Technologies is an IoT and AI Solutions' platform for Digital Utilities and Smart Energy Networks. | Technologies: DataGlen's USP is an end-to-end vertical agnostic, scalable and secure technology stack that streamlines the integration of IoT into new businesses for operational intelligence. They have previously enabled applications in the energy, logistics and health care domains | Type: CleanTech company","Christal Bemont, CEO",,"Karnataka, India",,9,https://DT.com,CleanTech,"DataGlen's USP is an end-to-end vertical agnostic, scalable and secure technology stack that streamlines the integration of IoT into new businesses for operational intelligence. They have previously enabled applications in the energy, logistics and health care domains, with primary focus on the renewable sector - especially Solar, Energy Storage, Microgrid management. They presently monitor and help manage more than 250 MW of grid connected and rooftop solar installations across India.",,,https://indiaai.gov.in/startup/dataglen-technologies
Paralleldots Technologies Pvt. Ltd.,ParallelDot’s target audience helps enterprises leveraging the power of AI to improve their processes.,"ParallelDot’s target audience helps enterprises leveraging the power of AI to improve their processes. | Technologies: and Services, Publishing | Type: Media company",,,"Uttar Pradesh, India",,59,https://PTPL.com,Media,"and Services, Publishing",,,https://indiaai.gov.in/startup/paralleldots-technologies-pvt-ltd
Signzy,"Signzy offers a digital on-boarding solution for banks, NBFCs, financial institutions.","Signzy offers a digital on-boarding solution for banks, NBFCs, financial institutions. | Technologies: Signzy is a fintech company that makes regulatory processes for banks, NBFCs, and other financial institutions simple | Type: Fintech company",Aditya Birla Sun Life AMC,,,,72,https://signzy.com,Fintech,"Signzy is a fintech company that makes regulatory processes for banks, NBFCs, and other financial institutions simple, secure, and compliant. They harness the power of AI and Blockchain to enable their clients to adapt digitization and offer fully digital experiences to their users. Founded in 2015, Signzy today serves over 30 clients including some of the top public and private sector banks and several large NBFCs. They are backed by passionate investors who value innovation in both technology and design.",,,https://indiaai.gov.in/startup/signzy
Genrobotics,GenRobotic Innovations is specialized in design and development of robotic solutions.,"GenRobotic Innovations is specialized in design and development of robotic solutions. | Technologies: The Manhole Monitoring System (MMS) is a complete sanitation solution which monitors the manhole network, it collects the crucial data and process it using machine learning and AI technology to give an overall idea about the health of the manhole and giving an alert when it is getting clogged/overflowing. The MMS will also provide with updates for the routine maintenance of the manholes. | Type: AI/ML company",,,,,27,https://genrobotics.com,AI/ML,"The Manhole Monitoring System (MMS) is a complete sanitation solution which monitors the manhole network, it collects the crucial data and process it using machine learning and AI technology to give an overall idea about the health of the manhole and giving an alert when it is getting clogged/overflowing. The MMS will also provide with updates for the routine maintenance of the manholes.",,,https://indiaai.gov.in/startup/genrobotics
AuthBase,AuthBase is a CyberSecurity Company that provides frameworks to help developers secure their applications.,AuthBase is a CyberSecurity Company that provides frameworks to help developers secure their applications. | Type: Cybersecurity company,,,,,7,https://authbase.io,Cybersecurity,,,,https://indiaai.gov.in/startup/authbase
Fleetx.io,Fleetx is an intelligent fleet management platform.,Fleetx is an intelligent fleet management platform. | Type: SaaS company,Vineet Sharma,,"Haryana, India",,51,https://F.ai,SaaS,,,,https://indiaai.gov.in/startup/fleetx-io
DataOne,"DataOne provides customized analytics solutions to enterprises using machine ML, AI, and big data.","DataOne provides customized analytics solutions to enterprises using machine ML, AI, and big data. | Technologies: Data Architecture and design: Build and operate large scale systems capable of processing, storing, and analyzing a wide array of structured and unstructured data | Type: Technology company",Nikunj Thakkar is,,"Gujarat, India",,10,https://dataone.com,Technology,"Data Architecture and design: Build and operate large scale systems capable of processing, storing, and analyzing a wide array of structured and unstructured data, and data complexity are also managed by use of cutting edge technology.",,,https://indiaai.gov.in/startup/dataone
Spire Technologies,Spire technologies is a domain intelligence technology based AI platform that offers a contextual search engine to...,"Spire technologies is a domain intelligence technology based AI platform that offers a contextual search engine to... | Technologies: and Services, Online Recruitment | Type: SaaS company",,2008,"Karnataka, India",,0,https://spiretechnologies.com,SaaS,"and Services, Online Recruitment",,,https://indiaai.gov.in/startup/spire-technologies
Locus.sh,Locus is an intelligent decision-making and automation platform for logistics.,Locus is an intelligent decision-making and automation platform for logistics. | Type: SaaS company,,,,,168,https://tldrlss.com/article/2024/11/how-is-an-out-in-baseball-determined/,SaaS,,,,https://indiaai.gov.in/startup/locus-sh
Parentlane,AI powered pregnancy app and baby care app,AI powered pregnancy app and baby care app | Type: Other company,,,,,17,https://P.ai,Other,,,,https://indiaai.gov.in/startup/parentlane
Tricog Health Pvt Ltd,Tricog provides the fast and accurate real time diagnosis of an ECG using AI,Tricog provides the fast and accurate real time diagnosis of an ECG using AI | Technologies: and Artificial Intelligence to scale to over half a million ECG diagnosis in 4 years. | Type: AI/ML company,,,,,0,https://THPL.com,AI/ML,and Artificial Intelligence to scale to over half a million ECG diagnosis in 4 years.,,,https://indiaai.gov.in/startup/tricog-health-pvt-ltd
GoVocal AI,GoVocal.AI is a platform built to help businesses and developers build Voice Apps for AI assistants like Amazon Alexa...,"GoVocal.AI is a platform built to help businesses and developers build Voice Apps for AI assistants like Amazon Alexa... | Technologies: GoVocal.ai enables developers to build voice technology in business use-cases i.e. voice powered search, and voice activated kiosks etc. It can be used for adding voice capabilities to mobile apps, websites and IoT devices. | Type: SaaS company",,2017,"Haryana, India",,0,https://GA.com,SaaS,"GoVocal.ai enables developers to build voice technology in business use-cases i.e. voice powered search, and voice activated kiosks etc. It can be used for adding voice capabilities to mobile apps, websites and IoT devices.",,,https://indiaai.gov.in/startup/govocal-ai
Fyle Technologies,,Type: Technology company,Sivaramakrishnan Narayanan is the,2016,"Karnataka, India",,40,https://FT.com,Technology,,,,https://indiaai.gov.in/startup/fyle-technologies
Vahan,,"Vahan is a  company founded in 2016, based in Karnataka, India",,2016,"Karnataka, India",,40,https://vahan.com,Other,,,,https://indiaai.gov.in/startup/vahan
ContextAlly,Digital Advertising platform for advanced mobility.,Digital Advertising platform for advanced mobility. | Type: SaaS company,,2015,"Karnataka, India",,8,https://C.ai,SaaS,,,Multi-side business models,https://indiaai.gov.in/startup/contextally
InFeedo,People analytics and employee engagement platform.,People analytics and employee engagement platform. | Type: SaaS company,,2013,"Haryana, India",,50,https://infeedo.com,SaaS,,,,https://indiaai.gov.in/startup/infeedo
InsigniQ,"Fraud detection, credit scoring, and analytics platform.","Fraud detection, credit scoring, and analytics platform. | Type: SaaS company",of Insigniq,2016,"Karnataka, India",,10,https://I.ai,SaaS,,,,https://indiaai.gov.in/startup/insigniq
Praktice.ai,,"Praktice.ai is a  company founded in 2017, based in Karnataka, India",Srinath Akula,2017,"Karnataka, India",,50,https://P.ai,Other,,,,https://indiaai.gov.in/startup/praktice-ai
Streamoid,,"Streamoid is a  company founded in 2013, based in Karnataka, India",,2013,"Karnataka, India",,25,https://streamoid.com,Other,,,,https://indiaai.gov.in/startup/streamoid
Artivatic,AI and Computer Vision real-time decision making solution for enterprises.,"AI and Computer Vision real-time decision making solution for enterprises. | Technologies: Artivatic is an enterprise tech platform that automates decision making, prediction, personalization and recommendation in real time. It offers AI and Computer Vision technology for businesses which enables them to take pro-active decisions in real time. Its core technology 'connected-intelligence-data-genome' provides a view on individuals personalized | Type: SaaS company",is Layak Singh,2016,"Karnataka, India",,31,https://artivatic.com,SaaS,"Artivatic is an enterprise tech platform that automates decision making, prediction, personalization and recommendation in real time. It offers AI and Computer Vision technology for businesses which enables them to take pro-active decisions in real time. Its core technology 'connected-intelligence-data-genome' provides a view on individuals personalized, interest, taste, health, lifestyle, fitness, eating, entertainment and physiologic response in real time. This personalized and recommended real-time decision-making system enables consumers and businesses to manage their activities, lifestyle, time, health, users and interaction.",,,https://indiaai.gov.in/startup/artivatic
Aureus Analytics,AI-powered analytics platform for insurance companies.,AI-powered analytics platform for insurance companies. | Type: Fintech company,,2012,"Maharashta, India",,47,https://aureusanalytics.co.in,Fintech,,,,https://indiaai.gov.in/startup/aureus-analytics
Karza Technologies,Banking and business intelligence solution provider.,Banking and business intelligence solution provider. | Type: Fintech company,Omkar Shirhatti,2015,,,28,https://KT.io,Fintech,,,,https://indiaai.gov.in/startup/karza-technologies
FEDO,,"FEDO is a  company founded in 2017, based in Karnataka, India",,2017,"Karnataka, India",,5,https://fedo.com,Other,,,,https://indiaai.gov.in/startup/fedo
UnderstandBetter,All-in-One Employee Survey Platform for Growing Businesses.,"All-in-One Employee Survey Platform for Growing Businesses. | Technologies: UnderstandBetter is an AI-powered people analytics online platform that promotes open and transparent communication across all levels of the company. UnderstandBetter is a product of Skcript, an international technology consulting firm. It was developed for keeping manager - employee dynamics in mind and its impact on employee productivity, engagement and retention. The company manages people with an AI powered HR solution that provides customized | Type: SaaS company",,2016,"Tamil Nadu, India",,10,https://www.thesaurus.com/browse/HATE,SaaS,"UnderstandBetter is an AI-powered people analytics online platform that promotes open and transparent communication across all levels of the company. UnderstandBetter is a product of Skcript, an international technology consulting firm. It was developed for keeping manager - employee dynamics in mind and its impact on employee productivity, engagement and retention. The company manages people with an AI powered HR solution that provides customized, contextual solutions for employee engagement.",,,https://indiaai.gov.in/startup/understandbetter
