Company Name,Full Description,Description,Founder Name,Founded In,Location,Category,No. of Employees,Company Website,Company Type,Technologies,Business Functions,Business Model,IndiaAI URL
Insight.AI,"At InsightAI, we are redefining fraud detection and Anti-Money Laundering","At InsightAI, we are redefining fraud detection and Anti-Money Laundering | Technologies: : Advanced AI models designed to tackle evolving fraud patterns. | Type: Blockchain company",am the,2022,"Delhi, India",,10,https://I.ai,Blockchain,: Advanced AI models designed to tackle evolving fraud patterns.,,,https://indiaai.gov.in/startup/insight-ai
fxis.ai,,"fxis.ai is a  company founded in 2015, based in Gujrat, India",Hemen Ashodia is the,2015,"Gujrat, India",,75,https://f.ai,Other,,,,https://indiaai.gov.in/startup/fxis-ai
Technit Space and Aero Works Pvt. Ltd.,TSAW Drones is dedicated to advancing drone technology,"TSAW Drones is dedicated to advancing drone technology | Technologies: TSAW Drones is dedicated to advancing drone technology to transform drone deliveries by making them more efficient, reliable, and secure. This is achieved through minimizing human intervention and reducing the likelihood of errors | Type: Logistics company",,2019,"Uttar pradesh, India",,30,https://forumias.com/blog/download-utkarsh-dwivedi-ias-rank-5-upsc-cse-2021-mgp-test-copies-testimonial-2/,Logistics,"TSAW Drones is dedicated to advancing drone technology to transform drone deliveries by making them more efficient, reliable, and secure. This is achieved through minimizing human intervention and reducing the likelihood of errors, allowing for more consistent and automated operations. Our drones, with payload capacities ranging from 500 grams to 20 kilograms and a range of up to 120 kilometers, are designed to meet a wide variety of delivery needs. At the core of our system is T-Suite a powerful integration of the Drone Cloud Intelligence System (DCIS), Unpiloted Traffic Management (UTM), and a log analyzer. T-Suite utilizes AI and machine learning to provide real-time remote control, ensure regulatory compliance, and analyze post-flight data, resulting in autonomous and highly efficient drones. This suite enables single-click operations and is equipped with advanced, human-like intelligence, setting a new benchmark for automation in drone technology and logistics.",,,https://indiaai.gov.in/startup/technit-space-and-aero-works-pvt-ltd
Surepass Technology,,Type: Technology company,,2019,"Delhi, India",,50,https://ST.ai,Technology,,,,https://indiaai.gov.in/startup/surepass-technology
VaidhyaMegha Private Limited!,"Vaidhyamegha Pvt Ltd leads the charge in healthcare innovation, leveraging cutting-edge AI and cloud technologies.","Vaidhyamegha Pvt Ltd leads the charge in healthcare innovation, leveraging cutting-edge AI and cloud technologies. | Type: Healthcare company",,2018,"Telangana, India",,35,https://VPL.ai,Healthcare,,,,https://indiaai.gov.in/startup/vaidhyamegha-private-limited
Aviara Labs,"Aviara Labs is a cutting-edge AI development company that delivers scalable, AI-driven solutions that transform...","Aviara Labs is a cutting-edge AI development company that delivers scalable, AI-driven solutions that transform... | Type: Other company",,2024,"Uttar Pradesh, India",,10,https://aviaralabs.com,Other,,,,https://indiaai.gov.in/startup/aviara-labs
Olbrain Labs,,"Technologies: Alchemist: The Autonomous AGI System for Engineering AI Specialists, Alchemist is an innovative AGI system developed by Olbrain Labs, designed to autonomously engineer AI specialists tailored for various Core Objective Functions (CoFs). Recognizing that traditional generalist AI models come with significant drawbacks—such as high costs | Type: AgriTech company",,2017,"Haryana, India",,5,https://olbrainlabs.com,AgriTech,"Alchemist: The Autonomous AGI System for Engineering AI Specialists, Alchemist is an innovative AGI system developed by Olbrain Labs, designed to autonomously engineer AI specialists tailored for various Core Objective Functions (CoFs). Recognizing that traditional generalist AI models come with significant drawbacks—such as high costs, data vulnerability, and uncontrollable outputs—Alchemist addresses these limitations by creating lightweight, domain-specific AI specialists., By training a unique learning model from scratch for each client, Alchemist eliminates the need for extensive, resource-intensive models while ensuring optimal performance and privacy through private cloud deployment. This approach allows businesses to harness the power of AI without the typical constraints associated with generalist systems., As a pivotal component of IndiaAGI, Alchemist aims to drive innovation across sectors like healthcare, agriculture, education, and manufacturing, ultimately fueling substantial economic growth. By retaining local talent and integrating cultural values, Alchemist not only enhances India’s technological capabilities but also ensures that the development of AGI aligns with ethical considerations., With Alchemist, Olbrain Labs is committed to positioning India as a key player in the global AGI landscape, ensuring that the future of this transformative technology benefits all.",,,https://indiaai.gov.in/startup/olbrain-labs
CUBO-BOTS Private Limited,,"CUBO-BOTS Private Limited is a  company founded in 2024, based in Tripura, India",,2024,"Tripura, India",,3,https://CPL.com,Other,,,,https://indiaai.gov.in/startup/cubo-bots-private-limited
SCIKIQ,"SCIKIQ is a trailblazing no-code, data Fabric platform that harnesses Generative AI","SCIKIQ is a trailblazing no-code, data Fabric platform that harnesses Generative AI | Type: SaaS company",Who are the,2023,"Haryana, India",,15,https://scikiq.com,SaaS,,,,https://indiaai.gov.in/startup/scikiq
discovermyAI,,"discovermyAI is a  company founded in 2024, based in Chandigarh, India",,2024,"Chandigarh, India",,12,https://discovermyai.com,Other,,,,https://indiaai.gov.in/startup/discovermyai
Tecnod8 Innovations,Democratising Industrial Automation by building India's first dedicated Large Language model for Industrial Engineering,Democratising Industrial Automation by building India's first dedicated Large Language model for Industrial Engineering | Type: Other company,,2024,"Himachal Pradesh, India",,5,https://TI.com,Other,,,,https://indiaai.gov.in/startup/tecnod8-innovations
"At AiProff.ai , we are constantly pushing boundaries to build innovative solutions for Autism Spectrum Disorder...","At AiProff.ai , we are constantly pushing boundaries to build innovative solutions for Autism Spectrum Disorder...","At AiProff.ai , we are constantly pushing boundaries to build innovative solutions for Autism Spectrum Disorder... | Type: Other company",,2023,"Haryana, India",,4,,Other,,,,https://indiaai.gov.in/startup/aiproff-software-consulting-opc-private-limited
CogniSpark AI,,"CogniSpark AI is a  company founded in 2017, based in Maharastra, India",of Paradiso,2017,"Maharastra, India",,100,https://CA.com,Other,,,,https://indiaai.gov.in/startup/cognispark-ai
RR.ai by RightRemote.Team,,"RR.ai by RightRemote.Team is a  company founded in 2023, based in Kerala, India",,2023,"Kerala, India",,10,https://RbR.com,Other,,,,https://indiaai.gov.in/startup/rr-ai-by-rightremote-team
Coretus Technologies Pvt. Ltd.,"Welcome to Coretus Technologies, the powerhouse of innovation","Welcome to Coretus Technologies, the powerhouse of innovation | Technologies: OUR TECHNOLOGY ARSENAL | Type: Technology company",,2013,"Gujarat, India",,27,https://CTPL.ai,Technology,OUR TECHNOLOGY ARSENAL,,,https://indiaai.gov.in/startup/coretus-technologies-pvt-ltd
Assessli,,"Assessli is a  company founded in 2022, based in West Bengal, India",,2022,"West Bengal, India",,15,https://assessli.com,Other,,,,https://indiaai.gov.in/startup/assessli
Tensor Matics Inc,,"Tensor Matics Inc is a  company founded in 2017, based in Chandigarh, India",,2017,"Chandigarh, India",,10,,Other,,,,https://indiaai.gov.in/startup/tensor-matics-inc
Meetanshi Technologies LLP,"Meetanshi leverages cutting-edge AI technology to revolutionize Digital Marketing, Development, and Graphics Designing.","Meetanshi leverages cutting-edge AI technology to revolutionize Digital Marketing, Development, and Graphics Designing. | Technologies: Meetanshi leverages cutting-edge AI technology to revolutionize Digital Marketing, Development, and Graphics Designing. Our innovative approach combines the power of artificial intelligence with creative expertise | Type: Logistics company",,2017,"Gujarat, India",,35,https://MTL.com,Logistics,"Meetanshi leverages cutting-edge AI technology to revolutionize Digital Marketing, Development, and Graphics Designing. Our innovative approach combines the power of artificial intelligence with creative expertise, resulting in faster project delivery and superior outcomes. Discover how Meetanshi is shaping the future of these industries through AI-driven solutions.",,,https://indiaai.gov.in/startup/meetanshi-technologies-llp
Molecule AI Private Limited,,Technologies: Pharmacy and Automobile industry are... | Type: Healthcare company,,2023,"Delhi, India",,7,https://MAPL.ai,Healthcare,Pharmacy and Automobile industry are...,,,https://indiaai.gov.in/startup/molecule-ai-private-limited
Inference Labs,Inference Labs is a cutting-edge provider of comprehensive AI and data analytics and predictive modeling solutions,"Inference Labs is a cutting-edge provider of comprehensive AI and data analytics and predictive modeling solutions | Technologies: At Inference Labs, our commitment is to provide innovative and tailored solutions that align with the unique challenges and goals of each sector we serve. By combining cutting-edge technology with domain expertise, we empower our clients to unlock the full potential of their data | Type: CleanTech company",Sumit Arora,2018,"Karnataka, India",,50,https://inferencelabs.com,CleanTech,"At Inference Labs, our commitment is to provide innovative and tailored solutions that align with the unique challenges and goals of each sector we serve. By combining cutting-edge technology with domain expertise, we empower our clients to unlock the full potential of their data, stay ahead of the competition, and drive sustainable growth in their respective industries.",,,https://indiaai.gov.in/startup/inference-labs
PanScience Innovations,,"Technologies: At PSI, we are dedicated to nurturing ideas and transforming them into products that not only address current market needs but also set the stage for future trends. Our commitment to innovation and technology drives us to empower entrepreneurs and innovators to bring their visions to life. By fostering a culture of creativity and forward momentum, we aim to shape the future of industries through our impactful AI startups. | Type: Technology company",Anshul Pandey is the,2022,"New Delhi, India",,145,https://PI.io,Technology,"At PSI, we are dedicated to nurturing ideas and transforming them into products that not only address current market needs but also set the stage for future trends. Our commitment to innovation and technology drives us to empower entrepreneurs and innovators to bring their visions to life. By fostering a culture of creativity and forward momentum, we aim to shape the future of industries through our impactful AI startups.",,,https://indiaai.gov.in/startup/panscience-innovations
CHOICE,,Focus areas: Business Function | Type: Other company,is Alex Ilyash,2023,"Delhi, India",,15,https://choice.ai,Other,,Business Function,,https://indiaai.gov.in/startup/choice
SigTuple,,Focus areas: Business Function | Type: Other company,,2015,"Karnataka, India",,100,https://sigtuple.com,Other,,Business Function,,https://indiaai.gov.in/startup/sigtuple
Tap Health,,Focus areas: Business Function | Type: Other company,Currently serving as Co,2023,"Haryana, India",,16,https://TH.ai,Other,,Business Function,,https://indiaai.gov.in/startup/tap-health
Worxogo,,Focus areas: Business Function | Type: Other company,Anant Sood,2014,"Karnataka, India",,70,https://worxogo.com,Other,,Business Function,,https://indiaai.gov.in/startup/worxogo
EncipherHealth Pvt. Ltd.,"At EncipherHealth, we're pioneering the integration of artificial intelligence into the healthcare industry","At EncipherHealth, we're pioneering the integration of artificial intelligence into the healthcare industry | Focus areas: Business Function | Type: Healthcare company",,2023,"Tamilnadu, India",,15,https://EPL.com,Healthcare,,Business Function,,https://indiaai.gov.in/startup/encipherhealth-pvt-ltd
Parchaa,Parchaa is an integrated healthcare platform driven by AI.,Parchaa is an integrated healthcare platform driven by AI. | Focus areas: Business Function | Type: SaaS company,,2023,"Delhi, India",,35,https://parchaa.com,SaaS,,Business Function,,https://indiaai.gov.in/startup/parchaa
LawCrats,,Focus areas: Business Function | Type: Other company,Gajendra Singh,2020,"Uttar Pradesh, India",,5,https://lawcrats.com,Other,,Business Function,,https://indiaai.gov.in/startup/lawcrats
Insituate,Insituate is a pioneering deep-tech company revolutionizing the way businesses harness the potential of Generative AI...,Insituate is a pioneering deep-tech company revolutionizing the way businesses harness the potential of Generative AI... | Focus areas: Business Function | Type: Technology company,,2023,"New Delhi, India",,6,https://insituate.ai,Technology,,Business Function,,https://indiaai.gov.in/startup/insituate
TaxbotGPT,Innovative TaxbotGPT integrates cutting-edge LLM technology to revolutionize the way you navigate the complexities of...,Innovative TaxbotGPT integrates cutting-edge LLM technology to revolutionize the way you navigate the complexities of... | Focus areas: Business Function | Type: Technology company,,2020,"Delhi, India",,10,https://taxbotgpt.ai,Technology,,Business Function,,https://indiaai.gov.in/startup/taxbotgpt
PredCo,PredCo is an innovative Industrial AI platform focused on transforming the way industries handle predictive maintenance...,PredCo is an innovative Industrial AI platform focused on transforming the way industries handle predictive maintenance... | Focus areas: Business Function | Type: SaaS company,,2023,"Delhi, India",,16,https://predco.com,SaaS,,Business Function,,https://indiaai.gov.in/startup/predco
Sivi,,Focus areas: Business Function | Type: Other company,Ram Ganesan is,2019,"Karnataka, India",,12,https://sivi.com,Other,,Business Function,,https://indiaai.gov.in/startup/sivi
TechConative,TechConative is a premier technology solutions provider dedicated to driving innovation and excellence in the digital...,TechConative is a premier technology solutions provider dedicated to driving innovation and excellence in the digital... | Focus areas: Business Function | Type: Technology company,Vivek Dhaylan is the,2022,"TamilNadu, India",,22,https://techconative.com,Technology,,Business Function,,https://indiaai.gov.in/startup/techconative
DeepTek,,Focus areas: Business Function | Type: Other company,,2017,"Maharashtra, India",,200,https://deeptek.ai,Other,,Business Function,,https://indiaai.gov.in/startup/deeptek
"AIShield, a Bosch startup recognized by Gartner, stands at the forefront of cybersecurity for AI systems.",,Focus areas: Business Function | Type: Cybersecurity company,,2022,"Karnataka, India",,25,,Cybersecurity,,Business Function,,https://indiaai.gov.in/startup/aishield-a-bosch-startup
MicroGrid Technologies,,Focus areas: Business Function | Type: Technology company,,2020,"Andhra Pradesh, India",,37,https://microgrid-technologies.com,Technology,,Business Function,,https://indiaai.gov.in/startup/microgrid-technologies
DocMode AIDE,"DocMode AIDE is committed to democratizing access to advanced AI-based healthcare solutions, offering them free of...","DocMode AIDE is committed to democratizing access to advanced AI-based healthcare solutions, offering them free of... | Focus areas: Business Function | Type: Healthcare company",,2016,"Maharashtra, India",,17,https://DA.io,Healthcare,,Business Function,,https://indiaai.gov.in/startup/docmode-aide
Bizmorphic Research Private Limited,Bizmorphic Research Pvt.Ltd is a deep tech research company which is creating world's first AI powered Scientific...,Bizmorphic Research Pvt.Ltd is a deep tech research company which is creating world's first AI powered Scientific... | Focus areas: Business Function | Type: Technology company,,2022,"Maharashtra, India",,10,https://BRPL.com,Technology,,Business Function,,https://indiaai.gov.in/startup/bizmorphic-research-private-limited
Aisera,,Focus areas: Business Function | Type: Other company,Muddu Sudhakar is,2017,"Karnataka, India",,150,https://aisera.com,Other,,Business Function,,https://indiaai.gov.in/startup/aisera
Digital Hercules Innovation,"Digital Hercules Innovations is a Saas company that made an AI-powered content Generation App, CreatAiGenie","Digital Hercules Innovations is a Saas company that made an AI-powered content Generation App, CreatAiGenie | Focus areas: Business Function | Type: SaaS company",am the,2023,"Uttar Pradesh, India",,11,https://DHI.in,SaaS,,Business Function,,https://indiaai.gov.in/startup/digital-hercules-innovation
Shorthills AI,Shorthills AI is an end-to-end Generative AI and Data Engineering Solution Provider.,Shorthills AI is an end-to-end Generative AI and Data Engineering Solution Provider. | Focus areas: Business Function | Type: Other company,Who are the,2018,"Gurugram, India",,250,https://SA.ai,Other,,Business Function,,https://indiaai.gov.in/startup/shorthills-ai
Razberi,,Focus areas: Business Function | Type: Other company,Tom Galvin is the,2011,,,17,https://R.ai,Other,,Business Function,,https://indiaai.gov.in/startup/razberi
React Labs,"Up⤴️ is at the forefront of transforming modern Indian households. As India’s first D2C smart home upliance brand, our...","Up⤴️ is at the forefront of transforming modern Indian households. As India’s first D2C smart home upliance brand, our... | Focus areas: Business Function | Type: Other company",,2021,"Maharashtra, India",,50,https://react-labs.com,Other,,Business Function,,https://indiaai.gov.in/startup/react-labs
Clodura,"An AI-powered lead generation platform, to help you generate highly targeted Sales Qualified Leads.","An AI-powered lead generation platform, to help you generate highly targeted Sales Qualified Leads. | Focus areas: Business Function | Type: SaaS company",,2015,"Maharashtra, India",,70,https://tracxn.com/d/companies/clodura/__jGdrlV05mU2kiINP_qzB9Jx1NFES50iejKoAE2ZmdPE,SaaS,,Business Function,,https://indiaai.gov.in/startup/clodura
ClanConnect.ai,,Focus areas: Business Function | Type: Other company,,2020,"Delhi, India",,20,https://C.ai,Other,,Business Function,,https://indiaai.gov.in/startup/clanconnect-ai
City Surveillance is a start-up providing surveillance as a service.,,Focus areas: Business Function | Type: Other company,,2016,"Tamil Nadu, India",,5,https://www.adda247.com/exams/railway/rrb-alp-cbat-exam-official-mock-test/,Other,,Business Function,,https://indiaai.gov.in/startup/city-surveillance-services-private-limited
Clairco,,Focus areas: Business Function | Type: Other company,of Clairco,2018,"Karnataka, India",,20,https://clairco.com,Other,,Business Function,,https://indiaai.gov.in/startup/clairco
Ciphercode,"Ciphercode is specialized in Enterprise Digital Authentication solutions, serving brands thru SaaS & Licensed platforms.","Ciphercode is specialized in Enterprise Digital Authentication solutions, serving brands thru SaaS & Licensed platforms. | Focus areas: Business Function | Type: SaaS company",Bhaskar Busanagaraja,2018,"Karnataka, India",,15,https://ciphercode.com,SaaS,,Business Function,,https://indiaai.gov.in/startup/ciphercode
Cialfo,Leveraging technology to connect students to higher education institutions around the world,Leveraging technology to connect students to higher education institutions around the world | Focus areas: Business Function | Type: Technology company,and Co,2017,"Uttar Pradesh, India",,250,https://cialfo.ai,Technology,,Business Function,,https://indiaai.gov.in/startup/cialfo
Cerebras Systems,A computer systems company dedicated to accelerating deep learning.,A computer systems company dedicated to accelerating deep learning. | Focus areas: Business Function | Type: AI/ML company,person has recommended Andrew,2015,"Karnataka, India",,300,https://CS.tech,AI/ML,,Business Function,,https://indiaai.gov.in/startup/cerebras-systems
Cere Labs,Cere Labs is a deeptech startup that has developed an AI-platform aimed to process unstructured data for banks and...,Cere Labs is a deeptech startup that has developed an AI-platform aimed to process unstructured data for banks and... | Focus areas: Business Function | Type: SaaS company,,2015,"Maharashtra, India",,50,https://cerelabs.com,SaaS,,Business Function,,https://indiaai.gov.in/startup/cere-labs
Celusion Technologies,Celusion Technologies builds technology that creates new value in customer experiences and core operations for the...,Celusion Technologies builds technology that creates new value in customer experiences and core operations for the... | Focus areas: Business Function | Type: Technology company,,2004,"Maharashtra, India",,250,https://www.indiamart.com/celusiontechnologies/aboutus.html,Technology,,Business Function,,https://indiaai.gov.in/startup/celusion-technologies
Capital Numbers,A leading global provider of web applications and mobile app development and digital platform engineering services.,A leading global provider of web applications and mobile app development and digital platform engineering services. | Focus areas: Business Function | Type: SaaS company,Mukul Gupta in India,2012,"West Bengal, India",,600,https://capitalnumbers.com,SaaS,,Business Function,,https://indiaai.gov.in/startup/capital-numbers
CamfyVision Technologies Pvt Ltd.,,Focus areas: Business Function | Type: Technology company,,2017,"Karnataka, India",,50,https://CTPL.ai,Technology,,Business Function,,https://indiaai.gov.in/startup/camfyvision-technologies-pvt-ltd
ReadyAssist,"ReadyAssist is one of the leading 24/7 Roadside Assistance, Emergency Support & on the spot repair company for Bikes,...","ReadyAssist is one of the leading 24/7 Roadside Assistance, Emergency Support & on the spot repair company for Bikes,... | Focus areas: Business Function | Type: Other company",View Vimal Singh,2016,,,200,https://readyassist.in,Other,,Business Function,,https://indiaai.gov.in/startup/readyassist
ByGrad,An online education company that provides higher education professional certification programs.,An online education company that provides higher education professional certification programs. | Focus areas: Business Function | Type: EdTech company,,2016,"Karnataka, India",,250,https://bygrad.com,EdTech,,Business Function,,https://indiaai.gov.in/startup/bygrad
Builder.ai,An AI-powered platform designed to help build and operate software projects,An AI-powered platform designed to help build and operate software projects | Focus areas: Business Function | Type: SaaS company,Sachin Dev Duggal in,2012,"Haryana, India",,500,https://B.io,SaaS,,Business Function,,https://indiaai.gov.in/startup/builder-ai
Brillio,,Focus areas: Business Function | Type: Other company,Raj Mamodia is the,2014,"Karnataka, India",,1000,https://brillio.com,Other,,Business Function,,https://indiaai.gov.in/startup/brillio
Brightcove,Streaming technology company in the world.,Streaming technology company in the world. | Focus areas: Business Function | Type: Media company,,2004,"Maharashtra, India",,400,https://brightcove.com,Media,,Business Function,,https://indiaai.gov.in/startup/brightcove
BrightMoney,Bright is a mission-driven consumer fintech company dedicated to helping everyone delete debt and build wealth.,Bright is a mission-driven consumer fintech company dedicated to helping everyone delete debt and build wealth. | Focus areas: Business Function | Type: Fintech company,,2019,"Karnataka, India",,150,https://brightmoney.in,Fintech,,Business Function,,https://indiaai.gov.in/startup/brightmoney
Recogni,,Focus areas: Business Function | Type: Other company,and VP of AI,2017,,,0,https://recogni.com,Other,,Business Function,,https://indiaai.gov.in/startup/recogni
Recotap,Recotap is an Account-based Marketing (ABM) & Ad platform that helps B2B Marketing & Sales teams work together to...,Recotap is an Account-based Marketing (ABM) & Ad platform that helps B2B Marketing & Sales teams work together to... | Focus areas: Business Function | Type: SaaS company,is Arun Gopalaswami,2018,,,50,https://recotap.com,SaaS,,Business Function,,https://indiaai.gov.in/startup/recotap
Recursion,Recursion is a clinical-stage biotechnology company decoding biology by integrating technological innovations across...,Recursion is a clinical-stage biotechnology company decoding biology by integrating technological innovations across... | Focus areas: Business Function | Type: Healthcare company,Our Executive Leadership Team,2013,,,500,https://recursion.com,Healthcare,,Business Function,,https://indiaai.gov.in/startup/recursion
Bridcodes Global,"Bridcodes Global is a leading global medley of technology, design, innovation, marketing, and business consultation.","Bridcodes Global is a leading global medley of technology, design, innovation, marketing, and business consultation. | Focus areas: Business Function | Type: Technology company",,2008,"Karnataka, India",,50,https://bridcodes.net/,Technology,,Business Function,,https://indiaai.gov.in/startup/bridcodes-global
Borgfy,,Focus areas: Business Function | Type: Other company,,2020,"Delhi, India",,50,https://borgfy.com,Other,,Business Function,,https://indiaai.gov.in/startup/borgfy
